{
  "manifestVersion": "1.0.0",
  "schemaVersion": "1.0.0",
  "generatedBy": "system-admin-governance",
  "modules": [
    {
      "moduleKey": "workbench",
      "label": "工作台",
      "schoolGroup": "workbench",
      "featureKey": "todoMessage",
      "permissionPrefix": "workbench",
      "frontendRoutePrefixes": ["/admin/approval", "/admin/messages", "/admin/help", "/"],
      "backendApiPrefixes": ["/api/v1/dashboard", "/api/v1/todos", "/api/v1/messages", "/api/v1/message-center"],
      "dataOwner": "workbench",
      "dependencies": [],
      "entitlementRequired": false,
      "schoolVisible": true,
      "platformOnly": false,
      "aliases": []
    },
    {
      "moduleKey": "approval",
      "label": "审批中心",
      "schoolGroup": "workbench",
      "featureKey": "approval",
      "permissionPrefix": "approval",
      "frontendRoutePrefixes": ["/admin/approval"],
      "backendApiPrefixes": ["/api/v1/approval"],
      "dataOwner": "workbench",
      "dependencies": ["workbench"],
      "entitlementRequired": true,
      "schoolVisible": true,
      "platformOnly": false,
      "aliases": []
    },
    {
      "moduleKey": "messages",
      "label": "消息中心",
      "schoolGroup": "workbench",
      "featureKey": "todoMessage",
      "permissionPrefix": "workbench.message",
      "frontendRoutePrefixes": ["/admin/messages"],
      "backendApiPrefixes": ["/api/v1/messages", "/api/v1/message-center"],
      "dataOwner": "workbench",
      "dependencies": ["workbench"],
      "entitlementRequired": false,
      "schoolVisible": true,
      "platformOnly": false,
      "aliases": []
    },
    {
      "moduleKey": "dataCenter",
      "label": "数据中心",
      "schoolGroup": "workbench",
      "featureKey": "dataExport",
      "permissionPrefix": "dataCenter",
      "frontendRoutePrefixes": ["/admin/data-center"],
      "backendApiPrefixes": ["/api/v1/stats"],
      "dataOwner": "workbench",
      "dependencies": ["workbench"],
      "entitlementRequired": true,
      "schoolVisible": true,
      "platformOnly": false,
      "aliases": []
    },
    {
      "moduleKey": "studentProfile",
      "label": "学生档案",
      "schoolGroup": "studentAffairs",
      "featureKey": "studentProfile",
      "permissionPrefix": "student.profile",
      "frontendRoutePrefixes": ["/admin/student"],
      "backendApiPrefixes": ["/api/v1/students"],
      "dataOwner": "studentAffairs",
      "dependencies": [],
      "entitlementRequired": true,
      "schoolVisible": true,
      "platformOnly": false,
      "aliases": ["student360"]
    },
    {
      "moduleKey": "orientation",
      "label": "数字迎新",
      "schoolGroup": "studentAffairs",
      "featureKey": "orientation",
      "permissionPrefix": "orientation",
      "frontendRoutePrefixes": ["/admin/orientation"],
      "backendApiPrefixes": ["/api/v1/orientation"],
      "dataOwner": "studentAffairs",
      "dependencies": ["studentAffairs"],
      "entitlementRequired": true,
      "schoolVisible": true,
      "platformOnly": false,
      "aliases": []
    },
    {
      "moduleKey": "campusService",
      "label": "在校服务",
      "schoolGroup": "studentAffairs",
      "featureKey": "campusService",
      "permissionPrefix": "campusService",
      "frontendRoutePrefixes": ["/admin/campus-service"],
      "backendApiPrefixes": ["/api/v1/campus-service"],
      "dataOwner": "studentAffairs",
      "dependencies": [],
      "entitlementRequired": true,
      "schoolVisible": true,
      "platformOnly": false,
      "aliases": []
    },
    {
      "moduleKey": "studentAffairs",
      "label": "学工中心",
      "schoolGroup": "studentAffairs",
      "featureKey": "studentAffairs",
      "permissionPrefix": "studentAffairs",
      "frontendRoutePrefixes": ["/admin/student-affairs"],
      "backendApiPrefixes": ["/api/v1/student-affairs"],
      "dataOwner": "studentAffairs",
      "dependencies": [],
      "entitlementRequired": true,
      "schoolVisible": true,
      "platformOnly": false,
      "aliases": []
    },
    {
      "moduleKey": "academicLegacy",
      "label": "教务旧入口",
      "schoolGroup": "academicAffairs",
      "featureKey": "academicAffairs",
      "permissionPrefix": "academicAffairs",
      "frontendRoutePrefixes": ["/admin/academic"],
      "backendApiPrefixes": ["/api/v1/academic"],
      "dataOwner": "academicAffairs",
      "dependencies": ["academicAffairs"],
      "entitlementRequired": true,
      "schoolVisible": true,
      "platformOnly": false,
      "aliases": ["academic"],
      "notes": "旧教务兼容入口，门禁映射 academicAffairs"
    },
    {
      "moduleKey": "academicAffairs",
      "label": "教务中心",
      "schoolGroup": "academicAffairs",
      "featureKey": "academicAffairs",
      "permissionPrefix": "academicAffairs",
      "frontendRoutePrefixes": ["/admin/academic-affairs"],
      "backendApiPrefixes": ["/api/v1/academic-affairs"],
      "dataOwner": "academicAffairs",
      "dependencies": [],
      "entitlementRequired": true,
      "schoolVisible": true,
      "platformOnly": false,
      "aliases": []
    },
    {
      "moduleKey": "graduationDesign",
      "label": "毕业设计中心",
      "schoolGroup": "graduationDesign",
      "featureKey": "graduation",
      "permissionPrefix": "graduationDesign",
      "frontendRoutePrefixes": ["/admin/graduation"],
      "backendApiPrefixes": ["/api/v1/graduation"],
      "dataOwner": "graduationDesign",
      "dependencies": [],
      "entitlementRequired": true,
      "schoolVisible": true,
      "platformOnly": false,
      "aliases": ["graduation"],
      "notes": "graduationDesign ↔ graduation 显式映射"
    },
    {
      "moduleKey": "internship",
      "label": "岗位实习中心",
      "schoolGroup": "internship",
      "featureKey": "internship",
      "permissionPrefix": "internship",
      "frontendRoutePrefixes": ["/admin/internship"],
      "backendApiPrefixes": ["/api/v1/internship"],
      "dataOwner": "internship",
      "dependencies": [],
      "entitlementRequired": true,
      "schoolVisible": true,
      "platformOnly": false,
      "aliases": []
    },
    {
      "moduleKey": "employment",
      "label": "就业服务",
      "schoolGroup": "internship",
      "featureKey": "employment",
      "permissionPrefix": "employment",
      "frontendRoutePrefixes": ["/admin/employment"],
      "backendApiPrefixes": ["/api/v1/employment"],
      "dataOwner": "employment",
      "dependencies": [],
      "entitlementRequired": true,
      "schoolVisible": true,
      "platformOnly": false,
      "aliases": [],
      "notes": "独立 employment 功能键，不得复用 internship 门禁"
    },
    {
      "moduleKey": "systemAdmin",
      "label": "系统管理",
      "schoolGroup": "systemAdmin",
      "featureKey": "auditLog",
      "permissionPrefix": "systemAdmin",
      "frontendRoutePrefixes": ["/admin/system", "/admin/workflow"],
      "backendApiPrefixes": ["/api/v1/system", "/api/v1/implementation", "/api/v1/migration"],
      "dataOwner": "systemAdmin",
      "dependencies": [],
      "entitlementRequired": false,
      "schoolVisible": true,
      "platformOnly": false,
      "aliases": ["system"]
    },
    {
      "moduleKey": "platform",
      "label": "平台运营",
      "schoolGroup": "platform",
      "featureKey": "apiAccess",
      "permissionPrefix": "platform",
      "frontendRoutePrefixes": ["/admin/platform"],
      "backendApiPrefixes": ["/api/v1/platform"],
      "dataOwner": "platform",
      "dependencies": [],
      "entitlementRequired": false,
      "schoolVisible": false,
      "platformOnly": true,
      "aliases": []
    }
  ]
}
